{
  "$schema": "https://json-schema.org/draft/2020-12/schema",
  "$id": "https://tim-van-oudheusden.github.io/Dailies/v1/schema/popularity.schema.json",
  "title": "Dailies weekly popularity",
  "description": "data/v1/popularity.json: the weekly Popular and Trending shelves. method_version 0 means hand-curated.",
  "type": "object",
  "additionalProperties": false,
  "required": [
    "schema_version",
    "method_version",
    "week",
    "generated_at",
    "valid_until",
    "popular",
    "trending",
    "sources",
    "attribution"
  ],
  "properties": {
    "schema_version": { "const": 1 },
    "method_version": { "type": "integer", "minimum": 0 },
    "week": { "type": "string", "pattern": "^\\d{4}-W\\d{2}$" },
    "generated_at": { "type": "string", "format": "date-time" },
    "valid_until": { "type": "string", "format": "date-time" },
    "stale": { "type": "boolean", "default": false },
    "popular": { "type": "array", "items": { "$ref": "#/$defs/ranked" }, "minItems": 1, "maxItems": 20 },
    "trending": { "type": "array", "items": { "$ref": "#/$defs/ranked" }, "maxItems": 20 },
    "scores": {
      "type": "object",
      "description": "Per-game detail for transparency and next week's trend computation.",
      "additionalProperties": { "$ref": "#/$defs/score" }
    },
    "sources": {
      "type": "object",
      "additionalProperties": {
        "type": "object",
        "additionalProperties": false,
        "required": ["ok", "fetched_at"],
        "properties": {
          "ok": { "type": "boolean" },
          "fetched_at": { "type": "string", "format": "date-time" },
          "domains_resolved": { "type": "integer" },
          "domains_requested": { "type": "integer" },
          "error": { "type": "string" }
        }
      }
    },
    "attribution": { "type": "array", "items": { "type": "string" } },
    "report": {
      "type": "string",
      "description": "Relative URL of the human-readable report, e.g. ../docs/popularity/2026-W42.md"
    }
  },
  "$defs": {
    "ranked": {
      "type": "object",
      "additionalProperties": false,
      "required": ["id", "rank", "score"],
      "properties": {
        "id": { "type": "string" },
        "rank": { "type": "integer", "minimum": 1 },
        "score": { "type": "number", "minimum": 0, "maximum": 1 },
        "delta": { "type": ["number", "null"], "description": "Change vs trailing 4-week mean; trending only." },
        "reason": { "enum": ["score", "new", "carried_forward"] }
      }
    },
    "score": {
      "type": "object",
      "additionalProperties": false,
      "required": ["popularity"],
      "properties": {
        "popularity": { "type": "number" },
        "trend": { "type": ["number", "null"] },
        "tranco_rank": { "type": ["integer", "null"] },
        "radar_bucket": { "type": ["integer", "null"] },
        "wiki_views_7d": { "type": ["integer", "null"] },
        "hn_stories_28d": { "type": ["integer", "null"] },
        "shared_domain_weight": { "type": "number" },
        "history": { "type": "array", "items": { "type": "number" }, "maxItems": 8 }
      }
    }
  }
}
