{
  "attribution": [
    "Tranco (https://tranco-list.eu): domain ranks, used with attribution; licence not stated by its maintainers"
  ],
  "generated_at": "2026-10-19T04:21:09Z",
  "method_version": 2,
  "popular": [
    {
      "id": "nyt-connections",
      "rank": 1,
      "reason": "score",
      "score": 0.9574
    },
    {
      "id": "nyt-strands",
      "rank": 2,
      "reason": "score",
      "score": 0.9574
    },
    {
      "id": "worldle",
      "rank": 3,
      "reason": "score",
      "score": 0.4199
    },
    {
      "id": "globle",
      "rank": 4,
      "reason": "score",
      "score": 0.3873
    },
    {
      "id": "heardle",
      "rank": 5,
      "reason": "carried_forward",
      "score": 0.35
    }
  ],
  "schema_version": 1,
  "scores": {
    "framed": {
      "history": [
        0.3,
        0.3
      ],
      "popularity": 0.3435,
      "tranco_rank": 90000,
      "trend": 0.0435
    },
    "globle": {
      "history": [
        0.5,
        0.5,
        0.49
      ],
      "popularity": 0.3873,
      "tranco_rank": 57165,
      "trend": -0.1094
    },
    "heardle": {
      "history": [
        0.35,
        0.36
      ],
      "popularity": 0.35,
      "tranco_rank": null,
      "trend": -0.005
    },
    "nerdle": {
      "history": [],
      "popularity": 0.316,
      "tranco_rank": 119667,
      "trend": null
    },
    "nyt-connections": {
      "history": [],
      "popularity": 0.9574,
      "tranco_rank": 155,
      "trend": null
    },
    "nyt-strands": {
      "history": [],
      "popularity": 0.9574,
      "tranco_rank": 155,
      "trend": null
    },
    "scrandle": {
      "history": [],
      "popularity": 0.0728,
      "tranco_rank": 1487156,
      "trend": null
    },
    "semantle": {
      "history": [],
      "popularity": 0.2244,
      "tranco_rank": 309286,
      "trend": null
    },
    "tiny": {
      "history": [],
      "popularity": 0.0,
      "tranco_rank": null,
      "trend": null
    },
    "wordle": {
      "history": [
        0.9,
        0.9,
        0.9
      ],
      "popularity": 0.9574,
      "tranco_rank": 155,
      "trend": 0.0574
    },
    "worldle": {
      "history": [
        0.4,
        0.38,
        0.37
      ],
      "popularity": 0.4199,
      "tranco_rank": 40768,
      "trend": 0.0366
    }
  },
  "sources": {
    "tranco": {
      "domains_requested": 9,
      "domains_resolved": 7,
      "fetched_at": "2026-10-19T04:18:00Z",
      "ok": true
    }
  },
  "stale": false,
  "trending": [
    {
      "delta": 0.0574,
      "id": "wordle",
      "rank": 1,
      "reason": "score",
      "score": 0.0574
    },
    {
      "delta": 0.0435,
      "id": "framed",
      "rank": 2,
      "reason": "score",
      "score": 0.0435
    },
    {
      "delta": null,
      "id": "scrandle",
      "rank": 3,
      "reason": "new",
      "score": 0.0
    }
  ],
  "valid_until": "2026-10-29T04:21:09Z",
  "week": "2026-W43"
}
