{
  "schema_version": 1,
  "method_version": 2,
  "week": "2026-W42",
  "generated_at": "2026-10-12T04:21:09Z",
  "valid_until": "2026-10-22T04:21:09Z",
  "popular": [
    {
      "id": "wordle",
      "rank": 1,
      "score": 0.9
    }
  ],
  "trending": [],
  "sources": {},
  "attribution": [],
  "scores": {
    "wordle": {
      "popularity": 0.9,
      "history": [
        0.9,
        0.9
      ]
    },
    "worldle": {
      "popularity": 0.4,
      "history": [
        0.38,
        0.37
      ]
    },
    "heardle": {
      "popularity": 0.35,
      "history": [
        0.36
      ]
    },
    "globle": {
      "popularity": 0.5,
      "history": [
        0.5,
        0.49
      ]
    },
    "framed": {
      "popularity": 0.3,
      "history": [
        0.3
      ]
    }
  }
}
